{
  "schemaVersion": "product-authority.m0.approval.v1",
  "authorityId": "product-authority.m0.v1",
  "taskId": "CHAOTANG-V4-P1-SHANGSHUFANG-REAL-CHAIN-20260905",
  "repository": {
    "identity": "gitee.com/msxn/chaotang-os",
    "targetBranch": "ext-dev"
  },
  "request": {
    "baseCommit": "0e99b954727fab776503266df4f83209685cd2a7",
    "baseTree": "07328649481653ef6f00f1ae28b7fe0f9afb5e15",
    "approvalPath": ".harness/approvals/CHAOTANG-V4-P1-SHANGSHUFANG-REAL-CHAIN-20260905.json",
    "approvalCommitPaths": [
      ".harness/approvals/CHAOTANG-V4-P1-SHANGSHUFANG-REAL-CHAIN-20260905.json",
      "docs/product/tasks/2026-09-05-chaotang-v4-p1-shangshufang-real-chain.md",
      "docs/superpowers/plans/2026-09-05-chaotang-v4-p1-shangshufang-real-chain.md"
    ],
    "productPaths": [
      "frontend/src/app/study/StudyClient.test.ts",
      "frontend/src/app/study/StudyClient.tsx",
      "frontend/src/app/study/chancellorDraft.test.ts",
      "frontend/src/app/study/chancellorDraft.ts",
      "frontend/src/app/study/studyIntentConfirmation.test.ts",
      "frontend/src/app/study/studyIntentConfirmation.ts",
      "frontend/src/features/study-visual/DevStudyWorkspace.module.css",
      "frontend/src/features/study-visual/DevStudyWorkspace.test.ts",
      "frontend/src/features/study-visual/DevStudyWorkspace.tsx",
      "frontend/src/features/study-visual/studyTaskCockpit.test.ts",
      "frontend/src/features/study-visual/studyTaskCockpit.ts"
    ]
  },
  "nonGoals": [
    "AUTHORITY_HARNESS_CI_ADR_OR_RELEASE_CHANGE",
    "BACKEND_API_DATABASE_SCHEMA_OR_FACT_SOURCE_CHANGE",
    "CDESKTOP_MIGRATION_OR_SECOND_FRONTEND_FACT_SOURCE",
    "COMMIT_PUSH_MERGE_DEPLOY_OR_RUNNING_SERVICE_REPLACEMENT",
    "DADIAN_JUNJICHU_SCENEBOARD_FROZEN_PATH_OR_SHARED_GLOBAL_STYLE_CHANGE",
    "EXTERNAL_ACTION_AUTHORIZATION_OR_AUTO_EXECUTION",
    "FAKE_PAUSE_RESUME_SWARM_PROGRESS_ETA_ARCHIVE_OR_LIVE_SOURCE",
    "GENERIC_CHANGE_REQUEST_GLOBAL_TASK_LIST_OR_LINEAGE_API",
    "MODEL_PROVIDER_NETWORK_SECRET_PRODUCTION_OR_CUSTOMER_DATA",
    "NEW_AGENT_REGISTRY_TASK_DATABASE_APPROVAL_OR_ARCHIVE",
    "NEW_BFF_ROUTE_OR_PERSISTENT_DRAFT_STORE",
    "POST_ARCHIVE_DECISION_OR_SHIGUAN_WRITE_SURFACE",
    "THREE_PLAN_ENGINE_OR_NEW_DECISION_CONTRACT",
    "UNRELATED_FRONTEND_REFACTOR_OR_TWELFTH_PRODUCT_PATH"
  ],
  "verification": [
    {
      "id": "v01-study-v4-focused-tests",
      "tool": "node",
      "args": [
        "--test",
        "src/app/study/StudyClient.test.ts",
        "src/app/study/chancellorDraft.test.ts",
        "src/app/study/decreeStatus.test.ts",
        "src/app/study/studyIntentConfirmation.test.ts",
        "src/app/study/studySubmission.test.ts",
        "src/features/study-visual/DevStudyWorkspace.test.ts",
        "src/features/study-visual/studyTaskCockpit.test.ts"
      ],
      "cwd": "frontend",
      "timeoutMs": 180000
    },
    {
      "id": "v02-frontend-full-tests",
      "tool": "npm",
      "args": ["test"],
      "cwd": "frontend",
      "timeoutMs": 300000
    },
    {
      "id": "v03-frontend-lint",
      "tool": "npm",
      "args": ["run", "lint"],
      "cwd": "frontend",
      "timeoutMs": 300000
    },
    {
      "id": "v04-frontend-typecheck",
      "tool": "npm",
      "args": ["run", "typecheck"],
      "cwd": "frontend",
      "timeoutMs": 300000
    },
    {
      "id": "v05-frontend-build",
      "tool": "npm",
      "args": ["run", "build"],
      "cwd": "frontend",
      "timeoutMs": 300000
    },
    {
      "id": "v06-product-authority-regression",
      "tool": "node",
      "args": ["--test", "scripts/product-authority.test.mjs"],
      "cwd": ".",
      "timeoutMs": 180000
    },
    {
      "id": "v07-root-harness",
      "tool": "node",
      "args": ["scripts/check_harness.mjs"],
      "cwd": ".",
      "timeoutMs": 180000
    },
    {
      "id": "v08-root-harness-doctor",
      "tool": "node",
      "args": ["scripts/harness-doctor.mjs", "--check"],
      "cwd": ".",
      "timeoutMs": 180000
    },
    {
      "id": "v09-v2-convergence",
      "tool": "node",
      "args": ["scripts/ext-full-value-convergence.mjs", "--check"],
      "cwd": ".",
      "timeoutMs": 180000
    },
    {
      "id": "v10-v2-convergence-regression",
      "tool": "node",
      "args": ["--test", "scripts/ext-full-value-convergence.test.mjs"],
      "cwd": ".",
      "timeoutMs": 180000
    },
    {
      "id": "v11-diff-check",
      "tool": "node",
      "args": [
        "--input-type=module",
        "--eval",
        "import{execFileSync}from'node:child_process';execFileSync('/usr/bin/git',['diff','--check'],{stdio:'inherit',env:{PATH:'/usr/bin:/bin',GIT_CONFIG_NOSYSTEM:'1',GIT_NO_REPLACE_OBJECTS:'1',GIT_TERMINAL_PROMPT:'0'}})"
      ],
      "cwd": ".",
      "timeoutMs": 30000
    }
  ],
  "state": "APPROVED_FOR_ONE_CHILD"
}
