{
  "schemaVersion": "product-authority.m0.approval.v1",
  "authorityId": "product-authority.m0.v1",
  "taskId": "AGENTIC-ORG-OS-V1-PROJECT-ORGANIZATION-20260903",
  "repository": {
    "identity": "gitee.com/msxn/chaotang-os",
    "targetBranch": "ext-dev"
  },
  "request": {
    "baseCommit": "1a5cc4ea1d666d6d329a812b3a6f511df0764845",
    "baseTree": "884db5c9b906f727a68763cb2a16587b81177a22",
    "approvalPath": ".harness/approvals/AGENTIC-ORG-OS-V1-PROJECT-ORGANIZATION-20260903.json",
    "approvalCommitPaths": [
      ".harness/approvals/AGENTIC-ORG-OS-V1-PROJECT-ORGANIZATION-20260903.json"
    ],
    "productPaths": [
      "backend/app/api/project_organizations.py",
      "backend/app/main.py",
      "backend/app/project_organizations/__init__.py",
      "backend/app/project_organizations/models.py",
      "backend/app/project_organizations/storage.py",
      "backend/tests/test_project_organizations_api.py",
      "frontend/src/app/api/court/project-organizations/[projectId]/route.ts",
      "frontend/src/app/api/court/project-organizations/from-scene-run/[runId]/route.ts",
      "frontend/src/app/api/court/project-organizations/route.ts",
      "frontend/src/app/junjichu/project-organizations/[projectId]/page.tsx",
      "frontend/src/app/junjichu/project-organizations/page.tsx",
      "frontend/src/features/junjichu-visual/JunjichuScene.module.css",
      "frontend/src/features/junjichu-visual/JunjichuScene.test.ts",
      "frontend/src/features/junjichu-visual/JunjichuScene.tsx",
      "frontend/src/features/project-organizations/ProjectOrganizationDetail.tsx",
      "frontend/src/features/project-organizations/ProjectOrganizationList.tsx",
      "frontend/src/features/project-organizations/client.ts",
      "frontend/src/features/project-organizations/projectOrganizations.module.css",
      "frontend/src/features/project-organizations/projectOrganizations.test.ts",
      "frontend/src/features/project-organizations/types.ts",
      "frontend/src/features/scene-packs/SceneBoard.tsx",
      "frontend/src/features/scene-packs/ScenePackWorkspace.tsx",
      "frontend/src/features/scene-packs/client.ts",
      "frontend/src/features/scene-packs/types.ts"
    ]
  },
  "nonGoals": [
    "AUTO_DEPLOY",
    "AUTO_MERGE",
    "AUTO_PAYMENT",
    "AUTO_PUSH_PRODUCT_CANDIDATE",
    "AUTO_SIGNING",
    "AUTO_TRANSACTION",
    "EXTERNAL_PROVIDER_CALL",
    "GONGBU_REAL_CODEX_CALL",
    "LANGGRAPH_REPLACEMENT",
    "SECOND_AGENT_FRAMEWORK",
    "SECOND_TASK_SOURCE_OF_TRUTH"
  ],
  "verification": [
    {
      "id": "backend-project-organization-ruff",
      "tool": "python3",
      "args": [
        "-m",
        "ruff",
        "check",
        "app/api/project_organizations.py",
        "app/project_organizations",
        "tests/test_project_organizations_api.py"
      ],
      "cwd": "backend",
      "timeoutMs": 180000
    },
    {
      "id": "backend-project-organization-tests",
      "tool": "python3",
      "args": [
        "-m",
        "pytest",
        "-q",
        "tests/test_project_organizations_api.py",
        "tests/test_scene_pack_api.py"
      ],
      "cwd": "backend",
      "timeoutMs": 180000
    },
    {
      "id": "frontend-project-organization-tests",
      "tool": "npm",
      "args": [
        "run",
        "test",
        "--",
        "src/app/api/routeExports.test.ts",
        "src/features/junjichu-visual/JunjichuScene.test.ts",
        "src/features/project-organizations/projectOrganizations.test.ts"
      ],
      "cwd": "frontend",
      "timeoutMs": 180000
    },
    {
      "id": "frontend-typecheck",
      "tool": "npm",
      "args": [
        "run",
        "typecheck"
      ],
      "cwd": "frontend",
      "timeoutMs": 180000
    },
    {
      "id": "git-diff-check",
      "tool": "node",
      "args": [
        "--input-type=module",
        "--eval",
        "import{execFileSync}from'node:child_process';execFileSync('/usr/bin/git',['--no-replace-objects','diff','--check','HEAD^','HEAD'],{stdio:'inherit',env:{PATH:'/usr/bin:/bin',GIT_CONFIG_NOSYSTEM:'1',GIT_NO_REPLACE_OBJECTS:'1',GIT_TERMINAL_PROMPT:'0'}})"
      ],
      "cwd": ".",
      "timeoutMs": 30000
    }
  ],
  "state": "APPROVED_FOR_ONE_CHILD"
}
