{
  "schemaVersion": "product-authority.m0.approval.v1",
  "authorityId": "product-authority.m0.v1",
  "taskId": "CT-ENTERPRISE-C01C-DEEP-LINK-RECOVERY-UI-CONTINUITY-20260912",
  "repository": {
    "identity": "gitee.com/msxn/chaotang-os",
    "targetBranch": "ext-dev"
  },
  "request": {
    "baseCommit": "56e6fc4df26d4526575e3371adc93701541c4820",
    "baseTree": "ad4fa415f7e9ef76ea80df049419097da5329ad9",
    "approvalPath": ".harness/approvals/CT-ENTERPRISE-C01C-DEEP-LINK-RECOVERY-UI-CONTINUITY-20260912.json",
    "approvalCommitPaths": [
      ".harness/approvals/CT-ENTERPRISE-C01C-DEEP-LINK-RECOVERY-UI-CONTINUITY-20260912.json",
      "docs/product/tasks/2026-09-12-c01c-deep-link-recovery-ui-continuity.md"
    ],
    "productPaths": [
      "frontend/src/app/shiguan/shiguanController.test.ts",
      "frontend/src/app/shiguan/shiguanController.ts",
      "frontend/src/features/shiguan-visual/ShiguanWorkspace.tsx"
    ]
  },
  "nonGoals": [
    "BACKEND_CHANGES",
    "DATABASE_MIGRATION",
    "DEPLOYMENT",
    "ERP_ACCESS",
    "MODEL_CALLS",
    "P14_FULL_PROJECTION",
    "PRODUCTION_DATA"
  ],
  "verification": [
    {"id": "frontend-build", "tool": "npm", "args": ["run", "build"], "cwd": "frontend", "timeoutMs": 300000},
    {"id": "frontend-lint", "tool": "npm", "args": ["run", "lint"], "cwd": "frontend", "timeoutMs": 300000},
    {"id": "frontend-test", "tool": "npm", "args": ["test"], "cwd": "frontend", "timeoutMs": 300000},
    {"id": "frontend-typecheck", "tool": "npm", "args": ["run", "typecheck"], "cwd": "frontend", "timeoutMs": 300000},
    {"id": "root-harness", "tool": "node", "args": ["scripts/check_harness.mjs"], "cwd": ".", "timeoutMs": 60000}
  ],
  "state": "APPROVED_FOR_ONE_CHILD"
}